
*** Running vivado
    with args -log Toplevel.vds -m64 -product Vivado -mode batch -messageDb vivado.pb -notrace -source Toplevel.tcl


****** Vivado v2019.1 (64-bit)
  **** SW Build 2552052 on Fri May 24 14:49:42 MDT 2019
  **** IP Build 2548770 on Fri May 24 18:01:18 MDT 2019
    ** Copyright 1986-2019 Xilinx, Inc. All Rights Reserved.

source Toplevel.tcl -notrace
Command: synth_design -top Toplevel -part xc7a35tcpg236-1
Starting synth_design
Attempting to get a license for feature 'Synthesis' and/or device 'xc7a35t'
INFO: [Common 17-349] Got license for feature 'Synthesis' and/or device 'xc7a35t'
INFO: [Device 21-403] Loading part xc7a35tcpg236-1
INFO: Launching helper process for spawning children vivado processes
INFO: Helper process launched with PID 21844 
---------------------------------------------------------------------------------
Starting RTL Elaboration : Time (s): cpu = 00:00:06 ; elapsed = 00:00:06 . Memory (MB): peak = 726.344 ; gain = 176.984
---------------------------------------------------------------------------------
INFO: [Synth 8-6157] synthesizing module 'Toplevel' [C:/Users/Bulls/Desktop/lab_4/lab_4.srcs/sources_1/new/Toplevel.v:23]
INFO: [Synth 8-6157] synthesizing module 'lab4_clks' [C:/Users/Bulls/Desktop/lab_4/lab_4.srcs/sources_1/imports/Desktop/lab4_clks.v:24]
INFO: [Synth 8-6157] synthesizing module 'clk_wiz_0' [C:/Users/Bulls/Desktop/lab_4/lab_4.srcs/sources_1/imports/Desktop/lab4_clks.v:56]
INFO: [Synth 8-6157] synthesizing module 'IBUF' [C:/Xilinx/Vivado/2019.1/scripts/rt/data/unisim_comp.v:32856]
	Parameter CAPACITANCE bound to: DONT_CARE - type: string 
	Parameter IBUF_DELAY_VALUE bound to: 0 - type: string 
	Parameter IBUF_LOW_PWR bound to: TRUE - type: string 
	Parameter IFD_DELAY_VALUE bound to: AUTO - type: string 
	Parameter IOSTANDARD bound to: DEFAULT - type: string 
INFO: [Synth 8-6155] done synthesizing module 'IBUF' (1#1) [C:/Xilinx/Vivado/2019.1/scripts/rt/data/unisim_comp.v:32856]
INFO: [Synth 8-6157] synthesizing module 'MMCME2_ADV' [C:/Xilinx/Vivado/2019.1/scripts/rt/data/unisim_comp.v:39813]
	Parameter BANDWIDTH bound to: OPTIMIZED - type: string 
	Parameter CLKFBOUT_MULT_F bound to: 9.125000 - type: float 
	Parameter CLKFBOUT_PHASE bound to: 0.000000 - type: float 
	Parameter CLKFBOUT_USE_FINE_PS bound to: FALSE - type: string 
	Parameter CLKIN1_PERIOD bound to: 10.000000 - type: float 
	Parameter CLKIN2_PERIOD bound to: 0.000000 - type: float 
	Parameter CLKOUT0_DIVIDE_F bound to: 36.500000 - type: float 
	Parameter CLKOUT0_DUTY_CYCLE bound to: 0.500000 - type: float 
	Parameter CLKOUT0_PHASE bound to: 0.000000 - type: float 
	Parameter CLKOUT0_USE_FINE_PS bound to: FALSE - type: string 
	Parameter CLKOUT1_DIVIDE bound to: 1 - type: integer 
	Parameter CLKOUT1_DUTY_CYCLE bound to: 0.500000 - type: float 
	Parameter CLKOUT1_PHASE bound to: 0.000000 - type: float 
	Parameter CLKOUT1_USE_FINE_PS bound to: FALSE - type: string 
	Parameter CLKOUT2_DIVIDE bound to: 1 - type: integer 
	Parameter CLKOUT2_DUTY_CYCLE bound to: 0.500000 - type: float 
	Parameter CLKOUT2_PHASE bound to: 0.000000 - type: float 
	Parameter CLKOUT2_USE_FINE_PS bound to: FALSE - type: string 
	Parameter CLKOUT3_DIVIDE bound to: 1 - type: integer 
	Parameter CLKOUT3_DUTY_CYCLE bound to: 0.500000 - type: float 
	Parameter CLKOUT3_PHASE bound to: 0.000000 - type: float 
	Parameter CLKOUT3_USE_FINE_PS bound to: FALSE - type: string 
	Parameter CLKOUT4_CASCADE bound to: FALSE - type: string 
	Parameter CLKOUT4_DIVIDE bound to: 1 - type: integer 
	Parameter CLKOUT4_DUTY_CYCLE bound to: 0.500000 - type: float 
	Parameter CLKOUT4_PHASE bound to: 0.000000 - type: float 
	Parameter CLKOUT4_USE_FINE_PS bound to: FALSE - type: string 
	Parameter CLKOUT5_DIVIDE bound to: 1 - type: integer 
	Parameter CLKOUT5_DUTY_CYCLE bound to: 0.500000 - type: float 
	Parameter CLKOUT5_PHASE bound to: 0.000000 - type: float 
	Parameter CLKOUT5_USE_FINE_PS bound to: FALSE - type: string 
	Parameter CLKOUT6_DIVIDE bound to: 1 - type: integer 
	Parameter CLKOUT6_DUTY_CYCLE bound to: 0.500000 - type: float 
	Parameter CLKOUT6_PHASE bound to: 0.000000 - type: float 
	Parameter CLKOUT6_USE_FINE_PS bound to: FALSE - type: string 
	Parameter COMPENSATION bound to: ZHOLD - type: string 
	Parameter DIVCLK_DIVIDE bound to: 1 - type: integer 
	Parameter IS_CLKINSEL_INVERTED bound to: 1'b0 
	Parameter IS_PSEN_INVERTED bound to: 1'b0 
	Parameter IS_PSINCDEC_INVERTED bound to: 1'b0 
	Parameter IS_PWRDWN_INVERTED bound to: 1'b0 
	Parameter IS_RST_INVERTED bound to: 1'b0 
	Parameter REF_JITTER1 bound to: 0.010000 - type: float 
	Parameter REF_JITTER2 bound to: 0.010000 - type: float 
	Parameter SS_EN bound to: FALSE - type: string 
	Parameter SS_MODE bound to: CENTER_HIGH - type: string 
	Parameter SS_MOD_PERIOD bound to: 10000 - type: integer 
	Parameter STARTUP_WAIT bound to: FALSE - type: string 
INFO: [Synth 8-6155] done synthesizing module 'MMCME2_ADV' (2#1) [C:/Xilinx/Vivado/2019.1/scripts/rt/data/unisim_comp.v:39813]
INFO: [Synth 8-6157] synthesizing module 'BUFG' [C:/Xilinx/Vivado/2019.1/scripts/rt/data/unisim_comp.v:1075]
INFO: [Synth 8-6155] done synthesizing module 'BUFG' (3#1) [C:/Xilinx/Vivado/2019.1/scripts/rt/data/unisim_comp.v:1075]
INFO: [Synth 8-6155] done synthesizing module 'clk_wiz_0' (4#1) [C:/Users/Bulls/Desktop/lab_4/lab_4.srcs/sources_1/imports/Desktop/lab4_clks.v:56]
INFO: [Synth 8-6157] synthesizing module 'clkcntrl4' [C:/Users/Bulls/Desktop/lab_4/lab_4.srcs/sources_1/imports/Desktop/lab4_clks.v:189]
INFO: [Synth 8-6157] synthesizing module 'GND' [C:/Xilinx/Vivado/2019.1/scripts/rt/data/unisim_comp.v:14643]
INFO: [Synth 8-6155] done synthesizing module 'GND' (5#1) [C:/Xilinx/Vivado/2019.1/scripts/rt/data/unisim_comp.v:14643]
INFO: [Synth 8-6157] synthesizing module 'CB4CE_MXILINX_clkcntrl4' [C:/Users/Bulls/Desktop/lab_4/lab_4.srcs/sources_1/imports/Desktop/lab4_clks.v:295]
INFO: [Synth 8-6157] synthesizing module 'FTCE_MXILINX_clkcntrl4' [C:/Users/Bulls/Desktop/lab_4/lab_4.srcs/sources_1/imports/Desktop/lab4_clks.v:265]
	Parameter INIT bound to: 1'b0 
INFO: [Synth 8-6157] synthesizing module 'XOR2' [C:/Xilinx/Vivado/2019.1/scripts/rt/data/unisim_comp.v:81988]
INFO: [Synth 8-6155] done synthesizing module 'XOR2' (6#1) [C:/Xilinx/Vivado/2019.1/scripts/rt/data/unisim_comp.v:81988]
INFO: [Synth 8-6157] synthesizing module 'FDCE' [C:/Xilinx/Vivado/2019.1/scripts/rt/data/unisim_comp.v:13448]
	Parameter INIT bound to: 1'b0 
	Parameter IS_CLR_INVERTED bound to: 1'b0 
	Parameter IS_C_INVERTED bound to: 1'b0 
	Parameter IS_D_INVERTED bound to: 1'b0 
INFO: [Synth 8-6155] done synthesizing module 'FDCE' (7#1) [C:/Xilinx/Vivado/2019.1/scripts/rt/data/unisim_comp.v:13448]
INFO: [Synth 8-6155] done synthesizing module 'FTCE_MXILINX_clkcntrl4' (8#1) [C:/Users/Bulls/Desktop/lab_4/lab_4.srcs/sources_1/imports/Desktop/lab4_clks.v:265]
INFO: [Synth 8-6157] synthesizing module 'AND4' [C:/Xilinx/Vivado/2019.1/scripts/rt/data/unisim_comp.v:562]
INFO: [Synth 8-6155] done synthesizing module 'AND4' (9#1) [C:/Xilinx/Vivado/2019.1/scripts/rt/data/unisim_comp.v:562]
INFO: [Synth 8-6157] synthesizing module 'AND3' [C:/Xilinx/Vivado/2019.1/scripts/rt/data/unisim_comp.v:514]
INFO: [Synth 8-6155] done synthesizing module 'AND3' (10#1) [C:/Xilinx/Vivado/2019.1/scripts/rt/data/unisim_comp.v:514]
INFO: [Synth 8-6157] synthesizing module 'AND2' [C:/Xilinx/Vivado/2019.1/scripts/rt/data/unisim_comp.v:466]
INFO: [Synth 8-6155] done synthesizing module 'AND2' (11#1) [C:/Xilinx/Vivado/2019.1/scripts/rt/data/unisim_comp.v:466]
INFO: [Synth 8-6157] synthesizing module 'VCC' [C:/Xilinx/Vivado/2019.1/scripts/rt/data/unisim_comp.v:81391]
INFO: [Synth 8-6155] done synthesizing module 'VCC' (12#1) [C:/Xilinx/Vivado/2019.1/scripts/rt/data/unisim_comp.v:81391]
INFO: [Synth 8-6155] done synthesizing module 'CB4CE_MXILINX_clkcntrl4' (13#1) [C:/Users/Bulls/Desktop/lab_4/lab_4.srcs/sources_1/imports/Desktop/lab4_clks.v:295]
INFO: [Synth 8-6157] synthesizing module 'BUF' [C:/Xilinx/Vivado/2019.1/scripts/rt/data/unisim_comp.v:1021]
INFO: [Synth 8-6155] done synthesizing module 'BUF' (14#1) [C:/Xilinx/Vivado/2019.1/scripts/rt/data/unisim_comp.v:1021]
INFO: [Synth 8-6155] done synthesizing module 'clkcntrl4' (15#1) [C:/Users/Bulls/Desktop/lab_4/lab_4.srcs/sources_1/imports/Desktop/lab4_clks.v:189]
WARNING: [Synth 8-4446] all outputs are unconnected for this instance and logic may be removed [C:/Users/Bulls/Desktop/lab_4/lab_4.srcs/sources_1/imports/Desktop/lab4_clks.v:39]
INFO: [Synth 8-6157] synthesizing module 'STARTUPE2' [C:/Xilinx/Vivado/2019.1/scripts/rt/data/unisim_comp.v:77870]
	Parameter PROG_USR bound to: FALSE - type: string 
	Parameter SIM_CCLK_FREQ bound to: 0.000000 - type: float 
INFO: [Synth 8-6155] done synthesizing module 'STARTUPE2' (16#1) [C:/Xilinx/Vivado/2019.1/scripts/rt/data/unisim_comp.v:77870]
INFO: [Synth 8-6155] done synthesizing module 'lab4_clks' (17#1) [C:/Users/Bulls/Desktop/lab_4/lab_4.srcs/sources_1/imports/Desktop/lab4_clks.v:24]
WARNING: [Synth 8-7023] instance 'slowit' of module 'lab4_clks' has 5 connections declared, but only 4 given [C:/Users/Bulls/Desktop/lab_4/lab_4.srcs/sources_1/new/Toplevel.v:44]
INFO: [Synth 8-6157] synthesizing module 'Edge_detect' [C:/Users/Bulls/Desktop/lab_4/lab_4.srcs/sources_1/new/Edge_detect.v:23]
INFO: [Synth 8-6157] synthesizing module 'FDRE' [C:/Xilinx/Vivado/2019.1/scripts/rt/data/unisim_comp.v:13664]
	Parameter INIT bound to: 1'b0 
	Parameter IS_C_INVERTED bound to: 1'b0 
	Parameter IS_D_INVERTED bound to: 1'b0 
	Parameter IS_R_INVERTED bound to: 1'b0 
INFO: [Synth 8-6155] done synthesizing module 'FDRE' (18#1) [C:/Xilinx/Vivado/2019.1/scripts/rt/data/unisim_comp.v:13664]
WARNING: [Synth 8-7023] instance 'e0' of module 'FDRE' has 5 connections declared, but only 4 given [C:/Users/Bulls/Desktop/lab_4/lab_4.srcs/sources_1/new/Edge_detect.v:33]
WARNING: [Synth 8-7023] instance 'e1' of module 'FDRE' has 5 connections declared, but only 4 given [C:/Users/Bulls/Desktop/lab_4/lab_4.srcs/sources_1/new/Edge_detect.v:34]
INFO: [Synth 8-6155] done synthesizing module 'Edge_detect' (19#1) [C:/Users/Bulls/Desktop/lab_4/lab_4.srcs/sources_1/new/Edge_detect.v:23]
INFO: [Synth 8-6157] synthesizing module 'countUD16L' [C:/Users/Bulls/Desktop/lab_4/lab_4.srcs/sources_1/new/countUD16L.v:23]
INFO: [Synth 8-6157] synthesizing module 'countUD4L' [C:/Users/Bulls/Desktop/lab_4/lab_4.srcs/sources_1/new/countUD4L.v:23]
WARNING: [Synth 8-7023] instance 'flip3' of module 'FDRE' has 5 connections declared, but only 4 given [C:/Users/Bulls/Desktop/lab_4/lab_4.srcs/sources_1/new/countUD4L.v:71]
WARNING: [Synth 8-7023] instance 'flip2' of module 'FDRE' has 5 connections declared, but only 4 given [C:/Users/Bulls/Desktop/lab_4/lab_4.srcs/sources_1/new/countUD4L.v:72]
WARNING: [Synth 8-7023] instance 'flip1' of module 'FDRE' has 5 connections declared, but only 4 given [C:/Users/Bulls/Desktop/lab_4/lab_4.srcs/sources_1/new/countUD4L.v:73]
WARNING: [Synth 8-7023] instance 'flip0' of module 'FDRE' has 5 connections declared, but only 4 given [C:/Users/Bulls/Desktop/lab_4/lab_4.srcs/sources_1/new/countUD4L.v:74]
INFO: [Synth 8-6155] done synthesizing module 'countUD4L' (20#1) [C:/Users/Bulls/Desktop/lab_4/lab_4.srcs/sources_1/new/countUD4L.v:23]
INFO: [Synth 8-6155] done synthesizing module 'countUD16L' (21#1) [C:/Users/Bulls/Desktop/lab_4/lab_4.srcs/sources_1/new/countUD16L.v:23]
INFO: [Synth 8-6157] synthesizing module 'Ring_Counter' [C:/Users/Bulls/Desktop/lab_4/lab_4.srcs/sources_1/new/Ring_Counter.v:23]
INFO: [Synth 8-6157] synthesizing module 'FDRE__parameterized0' [C:/Xilinx/Vivado/2019.1/scripts/rt/data/unisim_comp.v:13664]
	Parameter INIT bound to: 1'b1 
	Parameter IS_C_INVERTED bound to: 1'b0 
	Parameter IS_D_INVERTED bound to: 1'b0 
	Parameter IS_R_INVERTED bound to: 1'b0 
INFO: [Synth 8-6155] done synthesizing module 'FDRE__parameterized0' (21#1) [C:/Xilinx/Vivado/2019.1/scripts/rt/data/unisim_comp.v:13664]
WARNING: [Synth 8-7023] instance 'count0' of module 'FDRE' has 5 connections declared, but only 4 given [C:/Users/Bulls/Desktop/lab_4/lab_4.srcs/sources_1/new/Ring_Counter.v:36]
WARNING: [Synth 8-7023] instance 'count1' of module 'FDRE' has 5 connections declared, but only 4 given [C:/Users/Bulls/Desktop/lab_4/lab_4.srcs/sources_1/new/Ring_Counter.v:37]
WARNING: [Synth 8-7023] instance 'count2' of module 'FDRE' has 5 connections declared, but only 4 given [C:/Users/Bulls/Desktop/lab_4/lab_4.srcs/sources_1/new/Ring_Counter.v:38]
WARNING: [Synth 8-7023] instance 'count3' of module 'FDRE' has 5 connections declared, but only 4 given [C:/Users/Bulls/Desktop/lab_4/lab_4.srcs/sources_1/new/Ring_Counter.v:39]
INFO: [Synth 8-6155] done synthesizing module 'Ring_Counter' (22#1) [C:/Users/Bulls/Desktop/lab_4/lab_4.srcs/sources_1/new/Ring_Counter.v:23]
INFO: [Synth 8-6157] synthesizing module 'Selector' [C:/Users/Bulls/Desktop/lab_4/lab_4.srcs/sources_1/new/Selector.v:23]
INFO: [Synth 8-6155] done synthesizing module 'Selector' (23#1) [C:/Users/Bulls/Desktop/lab_4/lab_4.srcs/sources_1/new/Selector.v:23]
INFO: [Synth 8-6157] synthesizing module 'SevSeg' [C:/Users/Bulls/Desktop/lab_4/lab_4.srcs/sources_1/imports/new/SevSeg.v:23]
INFO: [Synth 8-6157] synthesizing module 'm8_1' [C:/Users/Bulls/Desktop/lab_4/lab_4.srcs/sources_1/imports/new/m8_1.v:23]
INFO: [Synth 8-6155] done synthesizing module 'm8_1' (24#1) [C:/Users/Bulls/Desktop/lab_4/lab_4.srcs/sources_1/imports/new/m8_1.v:23]
INFO: [Synth 8-6155] done synthesizing module 'SevSeg' (25#1) [C:/Users/Bulls/Desktop/lab_4/lab_4.srcs/sources_1/imports/new/SevSeg.v:23]
INFO: [Synth 8-6155] done synthesizing module 'Toplevel' (26#1) [C:/Users/Bulls/Desktop/lab_4/lab_4.srcs/sources_1/new/Toplevel.v:23]
---------------------------------------------------------------------------------
Finished RTL Elaboration : Time (s): cpu = 00:00:07 ; elapsed = 00:00:07 . Memory (MB): peak = 790.047 ; gain = 240.688
---------------------------------------------------------------------------------

Report Check Netlist: 
+------+------------------+-------+---------+-------+------------------+
|      |Item              |Errors |Warnings |Status |Description       |
+------+------------------+-------+---------+-------+------------------+
|1     |multi_driven_nets |      0|        0|Passed |Multi driven nets |
+------+------------------+-------+---------+-------+------------------+
---------------------------------------------------------------------------------
Start Handling Custom Attributes
---------------------------------------------------------------------------------
---------------------------------------------------------------------------------
Finished Handling Custom Attributes : Time (s): cpu = 00:00:07 ; elapsed = 00:00:07 . Memory (MB): peak = 790.047 ; gain = 240.688
---------------------------------------------------------------------------------
---------------------------------------------------------------------------------
Finished RTL Optimization Phase 1 : Time (s): cpu = 00:00:07 ; elapsed = 00:00:07 . Memory (MB): peak = 790.047 ; gain = 240.688
---------------------------------------------------------------------------------
INFO: [Netlist 29-17] Analyzing 36 Unisim elements for replacement
INFO: [Netlist 29-28] Unisim Transformation completed in 0 CPU seconds
INFO: [Project 1-570] Preparing netlist for logic optimization

Processing XDC Constraints
Initializing timing engine
Parsing XDC File [C:/Users/Bulls/Desktop/lab_4/lab_4.srcs/constrs_1/imports/Desktop/Basys3_Master.xdc]
Finished Parsing XDC File [C:/Users/Bulls/Desktop/lab_4/lab_4.srcs/constrs_1/imports/Desktop/Basys3_Master.xdc]
INFO: [Project 1-236] Implementation specific constraints were found while reading constraint file [C:/Users/Bulls/Desktop/lab_4/lab_4.srcs/constrs_1/imports/Desktop/Basys3_Master.xdc]. These constraints will be ignored for synthesis but will be used in implementation. Impacted constraints are listed in the file [.Xil/Toplevel_propImpl.xdc].
Resolution: To avoid this warning, move constraints listed in [.Xil/Toplevel_propImpl.xdc] to another XDC file and exclude this new file from synthesis with the used_in_synthesis property (File Properties dialog in GUI) and re-run elaboration/synthesis.
INFO: [Timing 38-2] Deriving generated clocks
Completed Processing XDC Constraints

Netlist sorting complete. Time (s): cpu = 00:00:00 ; elapsed = 00:00:00.001 . Memory (MB): peak = 915.809 ; gain = 0.000
INFO: [Project 1-111] Unisim Transformation Summary:
  A total of 34 instances were transformed.
  AND2 => LUT2: 8 instances
  AND3 => LUT3: 4 instances
  AND4 => LUT4: 4 instances
  BUF => LUT1: 2 instances
  XOR2 => LUT2: 16 instances

Constraint Validation Runtime : Time (s): cpu = 00:00:00 ; elapsed = 00:00:00.017 . Memory (MB): peak = 915.809 ; gain = 0.000
---------------------------------------------------------------------------------
Finished Constraint Validation : Time (s): cpu = 00:00:13 ; elapsed = 00:00:14 . Memory (MB): peak = 915.809 ; gain = 366.449
---------------------------------------------------------------------------------
---------------------------------------------------------------------------------
Start Loading Part and Timing Information
---------------------------------------------------------------------------------
Loading part: xc7a35tcpg236-1
---------------------------------------------------------------------------------
Finished Loading Part and Timing Information : Time (s): cpu = 00:00:13 ; elapsed = 00:00:14 . Memory (MB): peak = 915.809 ; gain = 366.449
---------------------------------------------------------------------------------
---------------------------------------------------------------------------------
Start Applying 'set_property' XDC Constraints
---------------------------------------------------------------------------------
---------------------------------------------------------------------------------
Finished applying 'set_property' XDC Constraints : Time (s): cpu = 00:00:13 ; elapsed = 00:00:14 . Memory (MB): peak = 915.809 ; gain = 366.449
---------------------------------------------------------------------------------
---------------------------------------------------------------------------------
Finished RTL Optimization Phase 2 : Time (s): cpu = 00:00:13 ; elapsed = 00:00:14 . Memory (MB): peak = 915.809 ; gain = 366.449
---------------------------------------------------------------------------------

Report RTL Partitions: 
+-+--------------+------------+----------+
| |RTL Partition |Replication |Instances |
+-+--------------+------------+----------+
+-+--------------+------------+----------+
---------------------------------------------------------------------------------
Start RTL Component Statistics 
---------------------------------------------------------------------------------
Detailed RTL Component Info : 
+---XORs : 
	   2 Input      1 Bit         XORs := 32    
---------------------------------------------------------------------------------
Finished RTL Component Statistics 
---------------------------------------------------------------------------------
---------------------------------------------------------------------------------
Start RTL Hierarchical Component Statistics 
---------------------------------------------------------------------------------
Hierarchical RTL Component report 
Module countUD4L 
Detailed RTL Component Info : 
+---XORs : 
	   2 Input      1 Bit         XORs := 8     
---------------------------------------------------------------------------------
Finished RTL Hierarchical Component Statistics
---------------------------------------------------------------------------------
---------------------------------------------------------------------------------
Start Part Resource Summary
---------------------------------------------------------------------------------
Part Resources:
DSPs: 90 (col length:60)
BRAMs: 100 (col length: RAMB18 60 RAMB36 30)
---------------------------------------------------------------------------------
Finished Part Resource Summary
---------------------------------------------------------------------------------
---------------------------------------------------------------------------------
Start Cross Boundary and Area Optimization
---------------------------------------------------------------------------------
Warning: Parallel synthesis criteria is not met 
---------------------------------------------------------------------------------
Finished Cross Boundary and Area Optimization : Time (s): cpu = 00:00:16 ; elapsed = 00:00:16 . Memory (MB): peak = 915.809 ; gain = 366.449
---------------------------------------------------------------------------------

Report RTL Partitions: 
+-+--------------+------------+----------+
| |RTL Partition |Replication |Instances |
+-+--------------+------------+----------+
+-+--------------+------------+----------+
---------------------------------------------------------------------------------
Start Applying XDC Timing Constraints
---------------------------------------------------------------------------------
---------------------------------------------------------------------------------
Finished Applying XDC Timing Constraints : Time (s): cpu = 00:00:23 ; elapsed = 00:00:24 . Memory (MB): peak = 915.809 ; gain = 366.449
---------------------------------------------------------------------------------
---------------------------------------------------------------------------------
Start Timing Optimization
---------------------------------------------------------------------------------
---------------------------------------------------------------------------------
Finished Timing Optimization : Time (s): cpu = 00:00:23 ; elapsed = 00:00:24 . Memory (MB): peak = 915.809 ; gain = 366.449
---------------------------------------------------------------------------------

Report RTL Partitions: 
+-+--------------+------------+----------+
| |RTL Partition |Replication |Instances |
+-+--------------+------------+----------+
+-+--------------+------------+----------+
---------------------------------------------------------------------------------
Start Technology Mapping
---------------------------------------------------------------------------------
---------------------------------------------------------------------------------
Finished Technology Mapping : Time (s): cpu = 00:00:23 ; elapsed = 00:00:24 . Memory (MB): peak = 915.809 ; gain = 366.449
---------------------------------------------------------------------------------

Report RTL Partitions: 
+-+--------------+------------+----------+
| |RTL Partition |Replication |Instances |
+-+--------------+------------+----------+
+-+--------------+------------+----------+
---------------------------------------------------------------------------------
Start IO Insertion
---------------------------------------------------------------------------------
---------------------------------------------------------------------------------
Start Flattening Before IO Insertion
---------------------------------------------------------------------------------
---------------------------------------------------------------------------------
Finished Flattening Before IO Insertion
---------------------------------------------------------------------------------
---------------------------------------------------------------------------------
Start Final Netlist Cleanup
---------------------------------------------------------------------------------
---------------------------------------------------------------------------------
Finished Final Netlist Cleanup
---------------------------------------------------------------------------------
---------------------------------------------------------------------------------
Finished IO Insertion : Time (s): cpu = 00:00:25 ; elapsed = 00:00:26 . Memory (MB): peak = 915.809 ; gain = 366.449
---------------------------------------------------------------------------------

Report Check Netlist: 
+------+------------------+-------+---------+-------+------------------+
|      |Item              |Errors |Warnings |Status |Description       |
+------+------------------+-------+---------+-------+------------------+
|1     |multi_driven_nets |      0|        0|Passed |Multi driven nets |
+------+------------------+-------+---------+-------+------------------+
---------------------------------------------------------------------------------
Start Renaming Generated Instances
---------------------------------------------------------------------------------
---------------------------------------------------------------------------------
Finished Renaming Generated Instances : Time (s): cpu = 00:00:25 ; elapsed = 00:00:26 . Memory (MB): peak = 915.809 ; gain = 366.449
---------------------------------------------------------------------------------

Report RTL Partitions: 
+-+--------------+------------+----------+
| |RTL Partition |Replication |Instances |
+-+--------------+------------+----------+
+-+--------------+------------+----------+
---------------------------------------------------------------------------------
Start Rebuilding User Hierarchy
---------------------------------------------------------------------------------
---------------------------------------------------------------------------------
Finished Rebuilding User Hierarchy : Time (s): cpu = 00:00:25 ; elapsed = 00:00:26 . Memory (MB): peak = 915.809 ; gain = 366.449
---------------------------------------------------------------------------------
---------------------------------------------------------------------------------
Start Renaming Generated Ports
---------------------------------------------------------------------------------
---------------------------------------------------------------------------------
Finished Renaming Generated Ports : Time (s): cpu = 00:00:25 ; elapsed = 00:00:26 . Memory (MB): peak = 915.809 ; gain = 366.449
---------------------------------------------------------------------------------
---------------------------------------------------------------------------------
Start Handling Custom Attributes
---------------------------------------------------------------------------------
---------------------------------------------------------------------------------
Finished Handling Custom Attributes : Time (s): cpu = 00:00:25 ; elapsed = 00:00:26 . Memory (MB): peak = 915.809 ; gain = 366.449
---------------------------------------------------------------------------------
---------------------------------------------------------------------------------
Start Renaming Generated Nets
---------------------------------------------------------------------------------
---------------------------------------------------------------------------------
Finished Renaming Generated Nets : Time (s): cpu = 00:00:25 ; elapsed = 00:00:26 . Memory (MB): peak = 915.809 ; gain = 366.449
---------------------------------------------------------------------------------
---------------------------------------------------------------------------------
Start Writing Synthesis Report
---------------------------------------------------------------------------------

Report BlackBoxes: 
+-+--------------+----------+
| |BlackBox name |Instances |
+-+--------------+----------+
+-+--------------+----------+

Report Cell Usage: 
+------+-----------+------+
|      |Cell       |Count |
+------+-----------+------+
|1     |AND2       |     6|
|2     |AND3       |     4|
|3     |AND4       |     3|
|4     |BUF        |     2|
|5     |BUFG       |     3|
|6     |LUT1       |     4|
|7     |LUT2       |     1|
|8     |LUT3       |     8|
|9     |LUT4       |    28|
|10    |LUT5       |    14|
|11    |LUT6       |    29|
|12    |MMCME2_ADV |     1|
|13    |STARTUPE2  |     1|
|14    |XOR2       |    16|
|15    |FDCE       |    16|
|16    |FDRE       |    24|
|17    |IBUF       |    22|
|18    |OBUF       |    28|
+------+-----------+------+

Report Instance Areas: 
+------+----------------+--------------------------+------+
|      |Instance        |Module                    |Cells |
+------+----------------+--------------------------+------+
|1     |top             |                          |   210|
|2     |  Rcounter      |Ring_Counter              |    23|
|3     |  bit16         |countUD16L                |    77|
|4     |    cnt0to3     |countUD4L                 |    24|
|5     |    cnt12to15   |countUD4L_19              |    15|
|6     |    cnt4to7     |countUD4L_20              |    18|
|7     |    cnt8to11    |countUD4L_21              |    20|
|8     |  down          |Edge_detect               |     5|
|9     |  slowit        |lab4_clks                 |    53|
|10    |    my_clk_inst |clk_wiz_0                 |     4|
|11    |    slowclk     |clkcntrl4                 |    48|
|12    |      XLXI_37   |CB4CE_MXILINX_clkcntrl4   |    12|
|13    |        I_Q0    |FTCE_MXILINX_clkcntrl4_15 |     2|
|14    |        I_Q1    |FTCE_MXILINX_clkcntrl4_16 |     2|
|15    |        I_Q2    |FTCE_MXILINX_clkcntrl4_17 |     2|
|16    |        I_Q3    |FTCE_MXILINX_clkcntrl4_18 |     2|
|17    |      XLXI_38   |CB4CE_MXILINX_clkcntrl4_1 |    12|
|18    |        I_Q0    |FTCE_MXILINX_clkcntrl4_11 |     2|
|19    |        I_Q1    |FTCE_MXILINX_clkcntrl4_12 |     2|
|20    |        I_Q2    |FTCE_MXILINX_clkcntrl4_13 |     2|
|21    |        I_Q3    |FTCE_MXILINX_clkcntrl4_14 |     2|
|22    |      XLXI_39   |CB4CE_MXILINX_clkcntrl4_2 |    10|
|23    |        I_Q0    |FTCE_MXILINX_clkcntrl4_7  |     2|
|24    |        I_Q1    |FTCE_MXILINX_clkcntrl4_8  |     2|
|25    |        I_Q2    |FTCE_MXILINX_clkcntrl4_9  |     2|
|26    |        I_Q3    |FTCE_MXILINX_clkcntrl4_10 |     2|
|27    |      XLXI_40   |CB4CE_MXILINX_clkcntrl4_3 |    11|
|28    |        I_Q0    |FTCE_MXILINX_clkcntrl4    |     2|
|29    |        I_Q1    |FTCE_MXILINX_clkcntrl4_4  |     2|
|30    |        I_Q2    |FTCE_MXILINX_clkcntrl4_5  |     2|
|31    |        I_Q3    |FTCE_MXILINX_clkcntrl4_6  |     2|
|32    |  up            |Edge_detect_0             |     3|
+------+----------------+--------------------------+------+
---------------------------------------------------------------------------------
Finished Writing Synthesis Report : Time (s): cpu = 00:00:25 ; elapsed = 00:00:26 . Memory (MB): peak = 915.809 ; gain = 366.449
---------------------------------------------------------------------------------
Synthesis finished with 0 errors, 0 critical warnings and 0 warnings.
Synthesis Optimization Runtime : Time (s): cpu = 00:00:16 ; elapsed = 00:00:24 . Memory (MB): peak = 915.809 ; gain = 240.688
Synthesis Optimization Complete : Time (s): cpu = 00:00:25 ; elapsed = 00:00:26 . Memory (MB): peak = 915.809 ; gain = 366.449
INFO: [Project 1-571] Translating synthesized netlist
INFO: [Netlist 29-17] Analyzing 33 Unisim elements for replacement
INFO: [Netlist 29-28] Unisim Transformation completed in 0 CPU seconds
INFO: [Project 1-570] Preparing netlist for logic optimization
INFO: [Opt 31-138] Pushed 0 inverter(s) to 0 load pin(s).
Netlist sorting complete. Time (s): cpu = 00:00:00 ; elapsed = 00:00:00 . Memory (MB): peak = 917.711 ; gain = 0.000
INFO: [Project 1-111] Unisim Transformation Summary:
  A total of 31 instances were transformed.
  AND2 => LUT2: 6 instances
  AND3 => LUT3: 4 instances
  AND4 => LUT4: 3 instances
  BUF => LUT1: 2 instances
  XOR2 => LUT2: 16 instances

INFO: [Common 17-83] Releasing license: Synthesis
69 Infos, 12 Warnings, 0 Critical Warnings and 0 Errors encountered.
synth_design completed successfully
synth_design: Time (s): cpu = 00:00:34 ; elapsed = 00:00:38 . Memory (MB): peak = 917.711 ; gain = 616.566
Netlist sorting complete. Time (s): cpu = 00:00:00 ; elapsed = 00:00:00 . Memory (MB): peak = 917.711 ; gain = 0.000
WARNING: [Constraints 18-5210] No constraints selected for write.
Resolution: This message can indicate that there are no constraints for the design, or it can indicate that the used_in flags are set such that the constraints are ignored. This later case is used when running synth_design to not write synthesis constraints to the resulting checkpoint. Instead, project constraints are read when the synthesized design is opened.
INFO: [Common 17-1381] The checkpoint 'C:/Users/Bulls/Desktop/lab_4/lab_4.runs/synth_1/Toplevel.dcp' has been generated.
INFO: [runtcl-4] Executing : report_utilization -file Toplevel_utilization_synth.rpt -pb Toplevel_utilization_synth.pb
INFO: [Common 17-206] Exiting Vivado at Wed Apr 27 20:25:43 2022...
